{
  "bug_id": "BUG-777",
  "title": "Webhook falha no retry",
  "severity": "high",
  "description": "Retry do webhook devolve 401 após expiração da sessão.",
  "expected_behavior": "O retry deve renovar a credencial.",
  "actual_behavior": "O segundo envio reutiliza token expirado.",
  "preconditions": "unknown",
  "bug_type": "security",
  "root_cause_category": "implementation",
  "root_cause_cluster": "unknown",
  "affected_module": "autenticação",
  "environment": "production",
  "status": "unknown",
  "created_at": "unknown",
  "detected_at": "unknown",
  "resolved_at": "unknown",
  "reopened": "unknown",
  "dev_analysis_notes": "Token foi armazenado fora do ciclo de retry.",
  "qa_analysis_notes": "Cenário reproduzido após o TTL.",
  "version": "unknown",
  "team": "unknown",
  "prd_reference": "unknown",
  "source_file": "C:\\Users\\C919409\\OneDrive - Anheuser-Busch InBev\\My Documents\\rca-agent-lab\\.worktrees\\rca-agentic-v1\\reports\\test-artifacts\\caf7edf3b16448298cfeb653dc5fe317\\single-bug.json",
  "source_row": 2,
  "cluster_id": "unknown",
  "duplicate_family_id": "unknown",
  "agent_suggested_severity": "unknown",
  "agent_suggested_bug_type": "security",
  "agent_suggested_root_cause_category": "implementation",
  "agent_suggestion_confidence": "medium",
  "agent_suggestion_rationale": "As regras encontraram 2 sinais textuais relevantes; a classificação reportada foi avaliada como consistent. Requer revisão humana.",
  "agent_review_status": "consistent"
}